{
  "$schema": "../schema/league.schema.json",
  "sleeperLeagueId": "1312235880743706624",
  "name": "The Mudd League",
  "shortName": "Mudd League",
  "description": "Standings, matchups, records and keepers for The Mudd League",
  "siteUrl": "https://muddleague.site",
  "founded": 2021,
  "blog": {
    "backend": "contentful",
    "title": "The Mudd Report",
    "intro": "The Monday recap and the midweek preview, written by someone who has been paying attention.",
    "comments": false,
    "contentful": {
      "postType": "blogPost",
      "commentType": "blogComment"
    }
  },
  "links": {
    "league": [
      {
        "name": "Keeper Draft Board",
        "note": "Keeper costs, who everyone is keeping, and the draft room.",
        "url": "https://garrett-pdx.github.io/keeper-draft-board/",
        "icon": "grid_view",
        "nav": {
          "label": "Keeper Draft Board",
          "icon": "calculate"
        }
      },
      {
        "name": "The league on Sleeper",
        "note": "Where lineups get set and trades get made.",
        "url": "{sleeper}",
        "icon": "sports_football"
      },
      {
        "name": "Constitution",
        "note": "The rules, as voted. Seven votes change them.",
        "url": "/constitution",
        "icon": "gavel"
      },
      {
        "name": "The Mudd Report",
        "note": "The Monday recap and the midweek preview.",
        "url": "/blog",
        "icon": "article"
      }
    ],
    "elsewhere": [
      {
        "name": "Half-PPR rankings: this week",
        "note": "FantasyPros expert consensus for RB, WR and TE.",
        "url": "https://www.fantasypros.com/nfl/rankings/half-point-ppr-flex.php",
        "icon": "leaderboard"
      },
      {
        "name": "Half-PPR rankings: rest of season",
        "note": "FantasyPros. Worth a look before a trade, or a keeper decision.",
        "url": "https://www.fantasypros.com/nfl/rankings/ros-half-point-ppr-overall.php",
        "icon": "trending_up"
      },
      {
        "name": "NFL injury report",
        "note": "The league's official practice and game-status reports, from NFL.com.",
        "url": "https://www.nfl.com/injuries/",
        "icon": "healing"
      },
      {
        "name": "FAAB and the waiver wire",
        "note": "4for4's 2026 waiver guide, with a section on spending a FAAB budget.",
        "url": "https://www.4for4.com/2026/preseason/ultimate-guide-winning-waiver-wire-2026",
        "icon": "payments"
      }
    ],
    "elsewhereNote": "All four are free to read."
  },
  "history": {
    "preSleeper": [
      {
        "season": 2021,
        "platform": "ESPN",
        "importedDraftId": "819042961097633792",
        "intro": "The founding season, on ESPN. The draft is all that made it to Sleeper.",
        "card": "The league's first season, played on ESPN. Only the draft made the move to Sleeper; no standings or results survive.",
        "story": "<p>The Mudd League started in 2021 on ESPN: ten teams, run by a group of friends, several of whom had played football together at Claremont-Mudd-Scripps. After one season it moved to Sleeper, and only one thing made the trip: the draft.</p><p>Sleeper filed that draft under the 2022 league, which is where it still lives. It was the baseline for every 2022 keeper price, since a keeper costs the round he went in the year before. The <a href=\"/seasons/2022\">2022 page</a> lists those keepers and what they cost.</p><p>Nothing else survives. There are no standings, scores, trades or champion from 2021, and anyone who claims to have won it is relying on everyone else's memory.</p>",
        "draftNote": "As imported into Sleeper. Jordan Leonard, who played through 2022 before Brenden Brown took his spot, drafted from slot 8."
      }
    ]
  },
  "pipeline": {
    "strict": true
  },
  "overrides": {
    "statCorrections": [
      {
        "season": 2023,
        "userId": "612407006212468736",
        "pf": -2,
        "note": "jonahcartwright v Gurret (weeks 5 and 14): his weekly scores sum 2.00 lower than the season record"
      },
      {
        "season": 2023,
        "userId": "76909640692416512",
        "pa": -2,
        "note": "the other side of the same correction"
      },
      {
        "season": 2024,
        "userId": "611649934390870016",
        "pf": 1,
        "note": "Kabroa v tuckersdumbteam (weeks 4 and 13): his weekly scores sum 1.00 higher"
      },
      {
        "season": 2024,
        "userId": "611664340277383168",
        "pa": 1,
        "note": "the other side of the same correction"
      }
    ],
    "eligibility": [
      {
        "season": 2022,
        "playerId": "4381",
        "positions": [
          "TE"
        ],
        "note": "Taysom Hill: TE alone reproduces Sleeper exactly in 2022"
      },
      {
        "season": 2023,
        "playerId": "4381",
        "positions": [
          "QB",
          "TE"
        ],
        "note": "Taysom Hill"
      },
      {
        "season": 2024,
        "playerId": "4381",
        "positions": [
          "QB",
          "TE"
        ],
        "note": "Taysom Hill"
      },
      {
        "season": 2025,
        "playerId": "4381",
        "positions": [
          "QB",
          "TE"
        ],
        "note": "Taysom Hill"
      },
      {
        "season": 2025,
        "playerId": "12530",
        "positions": [
          "WR"
        ],
        "note": "Travis Hunter: players.json says DB, which has no slot"
      }
    ]
  },
  "pages": {
    "records": {
      "intro": "Highs, lows and close calls since 2022. The lows are included on purpose."
    },
    "stat-lab": {
      "intro": "Every game since 2022. Filter it, sort it, chart it, and send the link to the group chat."
    },
    "drafts": {
      "intro": "Every draft on record, keepers badged. None of it can be undone."
    },
    "managers": {
      "intro": "Ten managers and one group chat. Pick a name for the bio, the roster and the record."
    },
    "transactions": {
      "intro": "Every trade and waiver claim since 2022, newest first. Receipts, for anyone who remembers it differently."
    },
    "seasons": {
      "intro": "Every season since the 2021 founding, one page each. The results are final; the arguments are not."
    }
  },
  "managers": [
    {
      "userId": "76909640692416512",
      "name": "Garrett Cheadle",
      "location": "Portland, OR",
      "photo": "gurret.jpg",
      "bio": "<strong>#24 &middot; RB &middot; 6'0&quot; &middot; 215 lbs &middot; Lincoln HS</strong><br /><em>CMS career: 36 G &middot; 17 GS &middot; 588 car &middot; 2,987 yds &middot; 33 rush TD &middot; 5.1 avg &middot; 26 rec, 228 yds, 1 TD &middot; 204 pts</em><br />Commissioner. Third all-time at Claremont-Mudd-Scripps in both rushing yards and rushing touchdowns. SCIAC Offensive Player of the Year and First-Team All-SCIAC as a junior in 2018, when he carried 245 times for 1,305 yards at 118.6 a game and set the program single-game record with 274 against Whittier. Came back for 763 yards and a career-best 11 touchdowns as a senior despite a midseason injury, adding Second-Team All-SCIAC, the National Football Foundation Hampshire Honors Society and the SCIAC All-Academic Team. Son of Jim and Maria Cheadle.<br /><em>Mudd League: Took Jayden Daniels with the 92nd pick of the 2024 draft, in round 10, and got 325.94 points out of him in thirteen starts as a rookie.</em>",
      "rival": {
        "userId": "605683461667229696"
      }
    },
    {
      "userId": "611697269254791168",
      "name": "Tyson-Jay Saena",
      "location": "Chandler, AZ",
      "photo": "tnt44.webp",
      "bio": "<strong>#44 &middot; DL &middot; 5'11&quot; &middot; 260 lbs &middot; Hamilton HS</strong><br /><em>CMS career: 36 G &middot; 14 GS &middot; 68 tackles &middot; 6 TFL for 17 &middot; 2 sacks for 11 &middot; 2 FR &middot; 1 FF</em><br />Defensive lineman whose CMS career ran from 2016 all the way to 2022, with a two-year absence (Ghana) in the middle that he returned from to play all ten games in 2019. Second-Team All-SCIAC in each of his final two seasons, and as a senior he recorded at least one tackle in every game he played. Opened 2021 with three tackles and a sack against Pomona-Pitzer. Sings and plays the ukulele. Husband of Maddie. Son of Allan and Joyce Saena.<br /><em>Mudd League: Opened 2024 at 2-6 and won his last nine, weeks 9 through 17, which is how a 9-6 team ends up fifth.</em>",
      "rival": {
        "userId": "850475150817234944"
      }
    },
    {
      "userId": "605683461667229696",
      "name": "Michael Streinz",
      "location": "Portland, OR",
      "photo": "mikestreinz.webp",
      "bio": "<strong>#74 &middot; OL &middot; 6'3&quot; &middot; 265 lbs &middot; Wilson HS</strong><br /><em>CMS career: offensive line, so the stat sheet is blank on principle</em><br />Guard, and the league's second Portlander. Started all ten games in 2019 on a line that led the nation in time of possession and averaged 199.7 rushing yards a game &mdash; including back-to-back afternoons of 376 and 393 on the ground against Occidental and Whittier, and 220 yards with 40:44 of possession to take the Sixth Street Trophy off Pomona-Pitzer. Which is another way of saying a good many of Garrett Cheadle's yards came out from behind him. National Football Foundation Hampshire Honors Society, twice SCIAC All-Academic, and a high school valedictorian. Son of Ray and Mary Streinz.<br /><em>Mudd League: Went 13-2 in 2023 with 1,920.46 points, the most wins and the most points of any regular season through 2025, and lost his semifinal to Tucker 100.58 to 87.50.</em>",
      "rival": {
        "userId": "76909640692416512"
      }
    },
    {
      "userId": "611664340277383168",
      "name": "Tucker Harris",
      "location": "Sarasota, FL",
      "photo": "tuckersdumbteam.webp",